{
  "$schema": "http://json-schema.org/draft-07/schema#",
  "title": "MultiFlexi App Definition",
  "type": "object",
  "properties": {
    "image": { "type": "string" },
    "name": { "type": "string" },
    "description": { "type": "string" },
    "executable": { "type": "string" },
    "setup": { "type": "string" },
    "cmdparams": { "type": "string" },
    "deploy": { "type": "string" },
    "homepage": { "type": "string" },
    "ociimage": { "type": "string" },
    "uuid": { "type": "string" },
    "topics": { "type": "string" },
    "requirements": { "type": "string" },
    "version": { "type": "string" },
    "multiflexi": { "type": "string" },
    "environment": {
      "type": "object",
      "patternProperties": {
        "^[A-Z0-9_]+$": {
          "type": "object",
          "properties": {
            "type": { "type": "string" },
            "description": { "type": "string" },
            "defval": {},
            "required": { "type": "boolean" },
            "hint": { "type": "string" },
            "options": {
              "type": ["object", "array"]
            }
          },
          "additionalProperties": true
        }
      }
    }
  },
  "required": [
    "name",
    "description",
    "executable",
    "environment"
  ],
  "additionalProperties": true
}